{
  "$schema": "https://json-schema.org/draft/2020-12/schema",
  "$id": "shell.schema.json",
  "title": "Wireframe app shell",
  "description": "모든 데스크톱 화면이 공유하는 앱 구조 — 사이드바(조직 신원·내비게이션·보는 사람)와 헤더의 자리. 화면 하나의 요소가 아니므로 screen.json에 담지 않고, 화면마다 복사하면 원본이 화면 수만큼 생기므로 wireframe 단위 카탈로그로 둔다. 헤더에 무엇을 쓸지는 각 화면의 meta가 갖는다 — 셸은 자리만 정한다. 근거: HOME-01K와 MY-01의 셸이 텍스트까지 동일하다(사례 2건).",
  "type": "object",
  "additionalProperties": false,
  "required": [
    "schemaVersion",
    "navigation"
  ],
  "properties": {
    "schemaVersion": {
      "const": 1
    },
    "brand": {
      "type": "object",
      "additionalProperties": false,
      "required": [
        "name"
      ],
      "description": "제품 신원. name은 고정 카피이고, 그 아래 붙는 조직 이름은 보는 사람마다 다르므로 서버에서 온다.",
      "properties": {
        "name": {
          "type": "string",
          "minLength": 1
        },
        "dataSourceKey": {
          "type": "string",
          "pattern": "^[A-Za-z0-9][A-Za-z0-9._-]{0,127}$",
          "description": "data-sources.json의 key. shape가 object여야 한다."
        },
        "subtitleField": {
          "type": "string",
          "minLength": 1,
          "description": "dataSourceKey가 가리키는 출처의 fields[].key. 조직 이름이 여기 온다."
        }
      },
      "dependentRequired": {
        "subtitleField": [
          "dataSourceKey"
        ]
      }
    },
    "navigation": {
      "type": "array",
      "minItems": 1,
      "description": "사이드바 메뉴. 순서가 화면에 그려지는 순서다. 지금 있는 화면으로 가는 항목은 targetScreenId를, 아직 없는 화면은 note를 갖는다(button.action의 navigate/pending과 같은 규칙).",
      "items": {
        "type": "object",
        "additionalProperties": false,
        "required": [
          "label"
        ],
        "oneOf": [
          {
            "required": [
              "targetScreenId"
            ]
          },
          {
            "required": [
              "note"
            ]
          }
        ],
        "properties": {
          "label": {
            "type": "string",
            "minLength": 1
          },
          "targetScreenId": {
            "type": "string",
            "pattern": "^[A-Za-z0-9][A-Za-z0-9._-]{0,127}$"
          },
          "note": {
            "type": "string",
            "minLength": 1,
            "description": "아직 명세되지 않은 화면임을 알리는 문구."
          }
        }
      }
    },
    "workspaces": {
      "type": "array",
      "minItems": 1,
      "description": "화면 **묶음**이 나눠 쓰는 머리(선택). 셸이 모든 화면의 것이라면 작업 공간은 몇 화면의 것이다 — 한 행사를 여는 화면 일곱(개요·업무·문서·관련 회의·일정·인원 관리·재정)은 갈피 줄과 상태 줄과 제목을 똑같이 그린다. 화면마다 적으면 원본이 일곱 개가 되고, 하나가 갈리면 같은 행사가 화면마다 달라 보인다. 화면은 screen.json의 workspace로 여기를 가리키고 **어디에 그리는지(nodeId)만** 자기가 갖는다 — 무엇을 그리는지는 여기가 안다.",
      "items": {
        "type": "object",
        "additionalProperties": false,
        "required": [
          "key",
          "description",
          "param",
          "tabs"
        ],
        "properties": {
          "key": {
            "type": "string",
            "pattern": "^[a-z][A-Za-z0-9]*$",
            "description": "작업 공간 이름. 예: event"
          },
          "description": {
            "type": "string",
            "minLength": 1
          },
          "param": {
            "type": "string",
            "pattern": "^[a-z][A-Za-z0-9]*$",
            "description": "이 공간이 무엇의 공간인지를 정하는 인자 이름. 여기 속한 화면은 이 이름의 인자를 반드시 받는다(screen.params) — 어느 행사의 개요인지는 화면 안에 없다. 제목과 상태 줄의 조회에 이 값이 넘어간다."
          },
          "titleFrom": {
            "type": "object",
            "additionalProperties": false,
            "required": [
              "dataSourceKey",
              "field"
            ],
            "description": "공간의 이름이 오는 곳(선택). 그것이 곧 속한 화면들의 제목이다 — 행사 개요의 제목도 행사 업무 보드의 제목도 그 행사의 이름이다. 화면의 meta.titleFrom과 같은 모양이며, 둘 다 있으면 화면 것이 이긴다.",
            "properties": {
              "dataSourceKey": {
                "type": "string",
                "pattern": "^[A-Za-z0-9][A-Za-z0-9._-]{0,127}$"
              },
              "field": {
                "type": "string",
                "minLength": 1
              }
            }
          },
          "status": {
            "type": "object",
            "additionalProperties": false,
            "required": [
              "dataSourceKey",
              "items"
            ],
            "description": "갈피를 옮겨 다녀도 그대로인 상태 줄(선택). 모양은 summary와 같다 — 항목이 명세에 고정이고, 라벨은 값이 라벨까지 품고 오는 자리에서는 없다.",
            "properties": {
              "dataSourceKey": {
                "type": "string",
                "pattern": "^[A-Za-z0-9][A-Za-z0-9._-]{0,127}$",
                "description": "shape가 object인 출처여야 한다."
              },
              "items": {
                "type": "array",
                "minItems": 1,
                "items": {
                  "type": "object",
                  "additionalProperties": false,
                  "required": [
                    "field"
                  ],
                  "properties": {
                    "label": {
                      "type": "string",
                      "minLength": 1
                    },
                    "field": {
                      "type": "string",
                      "minLength": 1
                    }
                  }
                }
              }
            }
          },
          "tabs": {
            "type": "array",
            "minItems": 2,
            "description": "갈피. 순서가 그려지는 순서다. **고르는 것이 아니라 옮겨 가는 것이다** — 갈피마다 다른 화면이라 select가 아니라 이동이다(한 화면 안에서 내용만 바뀌는 갈피와 다르다). 지금 있는 화면은 targetScreenId를, 아직 없는 화면은 note를 갖는다. 이동에는 이 공간의 param이 함께 간다.",
            "items": {
              "type": "object",
              "additionalProperties": false,
              "required": [
                "label"
              ],
              "oneOf": [
                {
                  "required": [
                    "targetScreenId"
                  ]
                },
                {
                  "required": [
                    "note"
                  ]
                }
              ],
              "properties": {
                "label": {
                  "type": "string",
                  "minLength": 1
                },
                "targetScreenId": {
                  "type": "string",
                  "pattern": "^[A-Za-z0-9][A-Za-z0-9._-]{0,127}$"
                },
                "note": {
                  "type": "string",
                  "minLength": 1
                },
                "targetField": {
                  "type": "string",
                  "minLength": 1,
                  "description": "이 갈피가 **공간의 상태에 따라 다른 화면으로** 갈 때, 그 상태를 아는 조각의 key(선택). 공간의 status가 읽는 출처의 조각이다.\n\n**그려지는 말이 아니라 열쇠다.** 상태의 이름('후속 정리 중')은 서버가 주는 글이라 명세가 들면 조직이 단계를 하나 바꿀 때마다 명세가 틀린다 — itemAction의 targetField가 같은 규칙이다."
                },
                "targets": {
                  "type": "array",
                  "minItems": 1,
                  "uniqueItems": true,
                  "description": "열쇠마다 갈 곳. targetField와 함께만 쓰고, **여기 없는 값이면 targetScreenId로 간다** — 갈피는 늘 갈 곳이 있어야 하므로 기본이 필요하다(요소의 targets는 기본이 없다 — 거기서는 갈 곳 없음이 뜻이 된다).",
                  "items": {
                    "type": "object",
                    "additionalProperties": false,
                    "required": [
                      "value",
                      "targetScreenId"
                    ],
                    "properties": {
                      "value": {
                        "type": "string",
                        "minLength": 1
                      },
                      "targetScreenId": {
                        "type": "string",
                        "pattern": "^[A-Za-z0-9][A-Za-z0-9._-]{0,127}$"
                      }
                    }
                  }
                }
              },
              "dependentRequired": {
                "targetField": [
                  "targets",
                  "targetScreenId"
                ],
                "targets": [
                  "targetField"
                ]
              }
            }
          }
        }
      }
    },
    "viewer": {
      "type": "object",
      "additionalProperties": false,
      "required": [
        "dataSourceKey",
        "nameField"
      ],
      "description": "사이드바 아래에 표시하는 '보는 사람'. 전부 서버 값이다.",
      "properties": {
        "dataSourceKey": {
          "type": "string",
          "pattern": "^[A-Za-z0-9][A-Za-z0-9._-]{0,127}$"
        },
        "nameField": {
          "type": "string",
          "minLength": 1
        },
        "roleField": {
          "type": "string",
          "minLength": 1,
          "description": "소속과 직책. 예: 운영부 · 부원"
        },
        "menu": {
          "type": "array",
          "minItems": 1,
          "description": "그 이름을 눌렀을 때 열리는 것(선택).\n\n**보는 사람 자리는 글이 아니라 문이다.** 어느 화면에 있든 자기 계정으로 가는 길이 여기여야 한다 — 이 자리가 없던 동안 로그아웃할 방법이 앱 어디에도 없었다(2026-09-09, 배포된 것을 쓰던 사람이 물었다).\n\n갈래는 둘이다: 어디로 데려가거나(targetScreenId), 무엇을 보내거나(mutationKey). 화면의 단추와 같은 어휘를 쓰되 셸은 화면이 아니므로 여기 따로 적는다.",
          "items": {
            "type": "object",
            "additionalProperties": false,
            "required": [
              "label"
            ],
            "properties": {
              "label": {
                "type": "string",
                "minLength": 1
              },
              "targetScreenId": {
                "type": "string",
                "minLength": 1
              },
              "mutationKey": {
                "type": "string",
                "pattern": "^[A-Za-z0-9][A-Za-z0-9._-]{0,127}$",
                "description": "mutations.json의 key. 보내고 나서 어디로 가는지는 onSuccess가 든다."
              },
              "onSuccess": {
                "type": "object",
                "additionalProperties": false,
                "required": [
                  "navigate"
                ],
                "properties": {
                  "navigate": {
                    "type": "string",
                    "minLength": 1
                  }
                }
              }
            },
            "anyOf": [
              {
                "required": [
                  "targetScreenId"
                ]
              },
              {
                "required": [
                  "mutationKey"
                ]
              }
            ]
          }
        }
      }
    },
    "design": {
      "type": "object",
      "additionalProperties": false,
      "required": [
        "excludeNodeNames"
      ],
      "description": "셸이 디자인에서 어떤 노드인지(선택). 추출기가 화면 요소를 뽑을 때 이 이름의 노드를 건너뛴다. 파이프라인은 wireframe의 레이어 이름을 알 수 없으므로 여기서 알려준다.",
      "properties": {
        "excludeNodeNames": {
          "type": "array",
          "minItems": 1,
          "uniqueItems": true,
          "items": {
            "type": "string",
            "minLength": 1
          }
        }
      }
    }
  }
}
