{
  "schemaVersion": 1,
  "design": {
    "excludeNodeNames": [
      "*/Sidebar"
    ]
  },
  "brand": {
    "name": "Vada",
    "dataSourceKey": "shell.organization",
    "subtitleField": "name"
  },
  "navigation": [
    {
      "label": "홈",
      "targetScreenId": "HOME-01K"
    },
    {
      "label": "내 업무",
      "targetScreenId": "MY-01"
    },
    {
      "label": "운영",
      "targetScreenId": "OPS-00"
    },
    {
      "label": "재정",
      "targetScreenId": "FIN-00"
    },
    {
      "label": "기록",
      "targetScreenId": "REC-01"
    },
    {
      "label": "조직 관리",
      "targetScreenId": "ORG-00"
    },
    {
      "label": "메시지",
      "targetScreenId": "MSG-01"
    }
  ],
  "workspaces": [
    {
      "key": "event",
      "description": "한 행사를 여는 화면들이 나눠 쓰는 머리. 갈피를 옮겨 다녀도 제목·상태 줄이 그대로다 — 그 값들은 화면이 아니라 그 행사에 딸려 있다.",
      "param": "eventId",
      "titleFrom": {
        "dataSourceKey": "event.summary",
        "field": "title"
      },
      "status": {
        "dataSourceKey": "event.workspace",
        "items": [
          {
            "field": "status"
          },
          {
            "field": "alert"
          },
          {
            "field": "host"
          },
          {
            "field": "startAt"
          },
          {
            "field": "nextSchedule"
          },
          {
            "field": "permissionNote"
          }
        ]
      },
      "tabs": [
        {
          "label": "개요",
          "targetScreenId": "EVT-02",
          "targetField": "statusKey",
          "targets": [
            {
              "value": "wrapUp",
              "targetScreenId": "EVT-02D"
            }
          ]
        },
        {
          "label": "업무",
          "targetScreenId": "EVT-TASK-01"
        },
        {
          "label": "문서",
          "targetScreenId": "EVT-DOC-01"
        },
        {
          "label": "관련 회의",
          "targetScreenId": "EVT-MEET-01"
        },
        {
          "label": "일정",
          "targetScreenId": "EVT-SCHED-01"
        },
        {
          "label": "인원 관리",
          "targetScreenId": "EVT-04"
        },
        {
          "label": "재정",
          "targetScreenId": "EVT-FIN-01"
        }
      ]
    }
  ],
  "viewer": {
    "dataSourceKey": "shell.viewer",
    "nameField": "name",
    "roleField": "role",
    "menu": [
      {
        "label": "내 정보",
        "targetScreenId": "MY-INFO-01"
      },
      {
        "label": "로그아웃",
        "mutationKey": "auth.signOut",
        "onSuccess": {
          "navigate": "SIGN-IN"
        }
      }
    ]
  }
}
